{
  "schema": "ev4-layout-check@0.1.0",
  "check_id": "LAYOUT-CHECK-READY-001",
  "selected_candidate_id": "ARCH-FAM-C",
  "target_scope": "Smart Home Section / Feature Cards Group",
  "layout_phase": "pre_content",
  "source_evidence_refs": ["SCREENSHOT-FEATURE-GROUP-001"],
  "required_controls": [
    {
      "control_name": "Display / layout mode",
      "status": "visible",
      "blocks_content_or_style": true,
      "evidence_refs": ["SCREENSHOT-FEATURE-GROUP-001"]
    },
    {
      "control_name": "Width / responsive scope",
      "status": "confirmed",
      "blocks_content_or_style": true,
      "evidence_refs": ["SCREENSHOT-FEATURE-GROUP-001", "USER-CONFIRM-001"]
    }
  ],
  "unit_strategy_resolved": true,
  "geometry_strategy_resolved": true,
  "responsive_scope_resolved": true,
  "overlay_strategy_resolved": true,
  "svg_strategy_resolved": true,
  "layout_check_complete": true,
  "content_or_style_batch_allowed": true,
  "normal_builder_batch_allowed": true,
  "required_next_action": "continue_builder_batch",
  "reason": "Required layout controls are visible or confirmed with evidence before content/style work."
}
